{
  "profile_version": "1.0",
  "contract_binding": {"contract_version": "2.0"},
  "object_type": "repair_evidence",
  "evidence_id": "evidence:w3b-a:fixture:001",
  "snapshot_digest": "sha256:1111111111111111111111111111111111111111111111111111111111111111",
  "snapshot_size": 4096,
  "findings": [
    {
      "code": "MISSING_REQUIRED_INDEX",
      "classification": "DETERMINISTIC_PLAN_CANDIDATE",
      "object_kind": "INDEX",
      "object_reference": "idx_audit_events_aggregate",
      "evidence_digest": "sha256:2222222222222222222222222222222222222222222222222222222222222222",
      "summary": "Canonical index is absent from the supplied snapshot."
    }
  ],
  "evidence_set_digest": "sha256:6c6906ceafc296e8997170abd5d4f719f10bfabee9e59efee105cbca4f632cec",
  "created_at": "2026-08-25T10:00:00Z",
  "shadow_status": "SHADOW_ONLY",
  "execution_eligibility": "EXECUTION_INELIGIBLE",
  "authority_status": "AUTHORITY_NONE",
  "mutation_status": "MUTATION_NONE",
  "governance_status": "UNAUTHENTICATED_SHADOW",
  "authority_effect": "NONE",
  "identity_effect": "NONE",
  "execution_effect": "NONE",
  "activation_effect": "NONE",
  "eligible_for_execution": false,
  "plan_effect": "NONE",
  "mutation_effect": "NONE"
}
